match,market_name,home_team,home_win,away_team,away_win,margin,agency
GWS Giants v Western Bulldogs,Head To Head,GWS Giants,1.63,Western Bulldogs,2.25,1.058,Sportsbet
Essendon Bombers v Fremantle Dockers,Head To Head,Essendon Bombers,1.45,Fremantle Dockers,2.69,1.061,Sportsbet
Gold Coast Suns v St Kilda Saints,Head To Head,Gold Coast Suns,1.57,St Kilda Saints,2.35,1.062,Sportsbet
Geelong Cats v Melbourne Demons,Head To Head,Geelong Cats,1.8,Melbourne Demons,2,1.056,Sportsbet
Port Adelaide Power v Adelaide Crows,Head To Head,Port Adelaide Power,6.5,Adelaide Crows,1.1,1.063,Sportsbet
Hawthorn Hawks v Carlton,Head To Head,Hawthorn Hawks,1.4,Carlton,2.9,1.059,Sportsbet
Brisbane Lions v North Melbourne Kangaroos,Head To Head,Brisbane Lions,1.55,North Melbourne Kangaroos,2.41,1.06,Sportsbet
