match,start_time,market_name,home_team,home_win,away_team,away_win,margin,agency
GWS Giants v Western Bulldogs,2024-08-31T03:07:00.000Z,Head To Head,GWS Giants,1.01,Western Bulldogs,26,1.029,TAB
Essendon Bombers v Fremantle Dockers,2024-08-31T05:05:00.000Z,Head To Head,Essendon Bombers,1.45,Fremantle Dockers,2.7,1.06,TAB
Gold Coast Suns v St Kilda Saints,2024-08-31T07:05:00.000Z,Head To Head,Gold Coast Suns,1.68,St Kilda Saints,2.15,1.06,TAB
Geelong Cats v Melbourne Demons,2024-08-31T09:15:00.000Z,Head To Head,Geelong Cats,1.85,Melbourne Demons,1.95,1.053,TAB
Port Adelaide Power v Adelaide Crows,2024-08-31T09:45:00.000Z,Head To Head,Port Adelaide Power,5.8,Adelaide Crows,1.13,1.057,TAB
Hawthorn Hawks v Carlton,2024-09-01T03:05:00.000Z,Head To Head,Hawthorn Hawks,1.55,Carlton,2.4,1.062,TAB
Brisbane Lions v North Melbourne Kangaroos,2024-09-01T05:05:00.000Z,Head To Head,Brisbane Lions,1.55,North Melbourne Kangaroos,2.4,1.062,TAB
